{"author":"Timur Isaev","record":"alloy-store-identity-selector-registry","selectors":[{"aggregate_sha256":"1563163e7bdbd3d54566845f45b0406c02a10e0f66c6a97ba4e55bc1f56be88e","artifact":{"kind":"scene-measurement","path":"spikes/GFX-001/results/2026-07-25-06-sir-brante-title-scene.md","sha256":"aa1a853eac5661694e1d08d16a4a543821c03c9e53b916fa18b5fe42802a5001"},"game_id":"1272160","image_hashes":{"The Life and Suffering of Sir Brante.exe":"1fb707b113f25388a6dacdd81140bf2205f4fe93c71e83d3169e58ab98f95455"},"manifest_ids":{"1272161":"3716404947812214693"},"selector_id":"gfx-001.result-06.1272160.24280929","store_build_id":"24280929","storefront":"steam"},{"aggregate_sha256":"1563163e7bdbd3d54566845f45b0406c02a10e0f66c6a97ba4e55bc1f56be88e","artifact":{"kind":"fingerprint","path":"spikes/STORE-001/results/fingerprint-1272160-first.json","sha256":"5c6b43999284b699461fb64e916b21eb17d0ea9067460bac51c1e2c269dadc5a"},"game_id":"1272160","image_hashes":{"The Life and Suffering of Sir Brante.exe":"1fb707b113f25388a6dacdd81140bf2205f4fe93c71e83d3169e58ab98f95455"},"manifest_ids":{"1272161":"3716404947812214693"},"selector_id":"store-001.fingerprint.1272160.24280929","store_build_id":"24280929","storefront":"steam"},{"aggregate_sha256":"1563163e7bdbd3d54566845f45b0406c02a10e0f66c6a97ba4e55bc1f56be88e","artifact":{"kind":"launch-policy","path":"spikes/STORE-001/runtime-launch/launch-sir-brante.sh","sha256":"ac203ae4bdc3bdc7915aff16416abf5fd275bc38adedcee8916aa5538bf6ea4d"},"game_id":"1272160","image_hashes":{"The Life and Suffering of Sir Brante.exe":"1fb707b113f25388a6dacdd81140bf2205f4fe93c71e83d3169e58ab98f95455","executableSHA256":"1fb707b113f25388a6dacdd81140bf2205f4fe93c71e83d3169e58ab98f95455","processPolicies[].imageSHA256":"1fb707b113f25388a6dacdd81140bf2205f4fe93c71e83d3169e58ab98f95455"},"manifest_ids":{"1272161":"3716404947812214693"},"selector_id":"store-001.launch-policy.sir-brante-24280929","store_build_id":"24280929","storefront":"steam"}],"version":1}
